description,genres,img,last_chapter,link,origin,published_date,state,title,type
"Riu Rokugiya est la seule fille d'une célèbre maison de théâtre kabuki. Depuis son enfance, elle rêve constamment d'un homme qu'elle rencontre sous une lune rouge. Un jour, elle assiste à une représentation de ses frères et apprend qu'il est l'un des héritiers des Akatsukiya, Rui Ashikawa. Les Akatsukiya sont des parents éloignés des Rokugiya et, récemment, leur chef, Enjûro Ashikawa, est mort. La famille est donc en train de choisir un successeur parmi les trois frères adoptifs, dont Rui.
Mais pourquoi Riu rêve-t-elle de Rui mourant chaque nuit ?",Shōjo,/imgs/mangas/akaki-tsuki-no-meguru-koro.jpg,https://www.japscan.me/manga/akaki-tsuki-no-meguru-koro/,https://www.japscan.me/manga/akaki-tsuki-no-meguru-koro/,Japon,,,Manga Akaki Tsuki No Meguru Koro,2009
"C'est l'histoire d'un garçon, Rwanda, dont la mère est une meurtrière vicieuse, situé en Angleterre à la fin du 19e siècle. Rwanda, qui a longtemps été confiné au sous-sol, a grandi et a quitté la maison après un certain incident. Finalement, il est arrivé à la ville et a été pris en charge par un membre du personnel de la maison de soins infirmiers et a décidé de vivre dans l'établissement. Mais la vie quotidienne paisible n'est ennuyeuse que pour Rwanda ...",Shounen,/imgs/mangas/akai-kiri-no-naka-kara.jpg,https://www.japscan.me/manga/akai-kiri-no-naka-kara/,https://www.japscan.me/manga/akai-kiri-no-naka-kara/,Japon,,,Manga Akai Kiri No Naka Kara,2019
"Takashi Amamiya 19 ans meurt après avoir trébuché sur une bouteille mais bizarrement il se retrouve dans un corps d'une jolie fille, Akane Hagiwara. Après ceci, Amamiya passe par de diverses épreuves et tribulations faisant face au fait qu'il est devenu une fille, récupéré son corps, et ses nouveaux et anciens amis...",Shōjo,/imgs/mangas/akane-chan-overdrive.jpg,https://www.japscan.me/manga/akane-chan-overdrive/,https://www.japscan.me/manga/akane-chan-overdrive/,Japon,,,Manga Akane-Chan Overdrive,1999
Tatsumi est un combattant qui débarque dans la capitale en espérant y réaliser ses rêves. Malheureusement il se fait dépouiller de son argent par une jeune femme dans une taverne. Sans le sous et à la rue il fait la connaissance d'une jeune noble qui lui propose de le loger pour la nuit. Ce qu'il ne sait pas encore c'est que sa protectrice va être attaquée par un groupe d’assassins...,Shōnen,/imgs/mangas/akame-ga-kiru.jpg,https://www.japscan.me/manga/akame-ga-kiru/,https://www.japscan.me/manga/akame-ga-kiru/,Japon,,,Manga Akame Ga Kiru,2010
"Au Japon, à l'ère Reiwa XX, les actes sexuels sont devenus illégaux en raison de la hausse du mouvement féministe et la fugue de certains extrémistes. Hikaru Inuda, un étudiant honorable est le fils d'un membre de la division de l'application des lois sexuelles est emmené pour la première fois dans un club par son ami peu fréquentable. Inuda va y découvrir quelque chose de choquant, ici le sexe et l'alcool y coulent à flots et les gens adorent ça. Parmi tout ce monde se trouve Misora, l'idole préférée de Inuda. Devant un monde inconnu, une étrange envie parcourt le corps d'Inuda.",Seinen,/imgs/mangas/akai-ringo.jpg,https://www.japscan.me/manga/akai-ringo/,https://www.japscan.me/manga/akai-ringo/,Japon,,,Manga Akai Ringo,2019
"Shinta s'est perfectionné 13 ans durant afin d'atteindre le statut de Shin'uchi, le plus haut rang des rakugo-ka. Mais malgré sa très bonne performance lors de l'examen de passage, le juge de l'épreuve, l'émérite Maître Arakawa Issho, a décidé de renvoyer de l'école Arakawa l'ensemble des participants sans donner davantage d'explication ! Ainsi s'arrêta nette la carrière de Shinta, qui avait tant sacrifié pour accomplir son rêve...

Mais Akane, la fille de Shinta qui admirait son père et son rakugo plus que tout, ne compte pas en rester là !",Shounen,/imgs/mangas/akane-banashi.jpg,https://www.japscan.me/manga/akane-banashi/,https://www.japscan.me/manga/akane-banashi/,Japon,,,Manga Akane Banashi,2022
"Japon, 1863, fin de l'ère Edo, c'est le temps des samouraïs. Sôshi Okita est un jeune manieur de sabre, encore nouveau dans son clan, mais néanmoins doué. Il est au service de son maître et ami Hijikata Toshizô, qui est lui aussi un jeune samouraï.",Seinen,/imgs/mangas/akaneiro-no-kaze.jpg,https://www.japscan.me/manga/akaneiro-no-kaze/,https://www.japscan.me/manga/akaneiro-no-kaze/,Japon,,,Manga Akaneiro No Kaze,1995
"Un jour, un client a fait irruption dans le magasin de confection de Takumi, demandant à acheter un costume qui ne lui allait pas bien – mais il était tellement pressé qu'il n'a pas ou rester assez longtemps pour le faire ajuster ou même prendre son reçu.
Il est revenu quelques jours plus tard pour s'excuser et commander un nouveau costume. Au fil du temps, Takumi commence à s'intéresser à Takano-sama.",Yaoi,/imgs/mangas/akari-o-otoshita-ato-de.jpg,https://www.japscan.me/manga/akari-o-otoshita-ato-de/,https://www.japscan.me/manga/akari-o-otoshita-ato-de/,Japon,,,Manga Akari O Otoshita Ato De,2010
"Le gouvernement, en réponse à la large baisse du taux de naissance du Japon, met en place un projet pour encourager les jeunes à former des couples. L’histoire prend place dans le lycée où a lieu le test initial du projet. Celui-ci, obligatoire, se résume très simplement : les élèves doivent former des couples ou ils mourront.",Shōnen,/imgs/mangas/akarui-sekai-keikaku.jpg,https://www.japscan.me/manga/akarui-sekai-keikaku/,https://www.japscan.me/manga/akarui-sekai-keikaku/,Japon,,,Manga Akarui Sekai Keikaku,2012
"L'histoire est basée sur le groupe d'idoles japonais AKB48. Hiroko Yoshinaga est une jeune adolescente. Comme toutes les lycéennes, elle écoute souvent ses groupes phares, principalement le groupe d'idoles AKB48. Hiroko rêve même de monter sur scènes avec les chanteuses. Or, il se trouve que la jeune fille est plutôt timide quant au fait de se produire devant des personnes. Mais Hiroko peut compter sur le soutien de son camarade de classe et ami Minoru Urayama, qui l'aide à combattre son point noir. En effet, le garçon ferait tout pour elle, ayant des sentiments à son égard. Alors quand Minoru apprend qu'une audition du groupe AKB48 se déroule non loin de chez eux, le garçon décide de s'inscrire avec son amie Hiroko à l'audition pour lui donner confiance et courage. Mais pour la passer sans se faire repérer, il devra se déguiser en fille ! Le moment des résultats arrivé, Hiroko découvre qu'elle a été sélectionnée et qu'elle va devoir travailler dur. Mais à la grande surprise des deux lycéens, Minoru est également sélectionné...",Shōnen,/imgs/mangas/akb49-renai-kinshi-jourei.jpg,https://www.japscan.me/manga/akb49-renai-kinshi-jourei/,https://www.japscan.me/manga/akb49-renai-kinshi-jourei/,Japon,,,Manga AKB49 - Renai Kinshi Jourei,2010
"AKB48 Satsujin Jiken est un manga policier adapté du groupe féminin japonais 'Murder Mystery' présent dans la campagne publicitaire pour des bonbons Glico de 'Ice no Mi'. Dans le manga, les membres de AKB48 découvrent le corps de leur compagnon Kato Rena. Maeda Atsuko arrive sur la scène du crime et commence à s'occuper de l'affaire. Les 89 autres membres actuels du groupe vont alors devenir suspects.",Shōnen,/imgs/mangas/akb48-satsujin-jiken.jpg,https://www.japscan.me/manga/akb48-satsujin-jiken/,https://www.japscan.me/manga/akb48-satsujin-jiken/,Japon,,,Manga AKB48 Satsujin Jiken,2012
"Kôji Shima est un jeune homme qui peine à trouver un job. Ses recherches d’emploi le mènent dans le quartier Tokyoïte d’Akihabara, où il découvre le monde des «Otakus», des «Cosplayeuses» et des bars où les serveuses
sont déguisées en soubrettes sexy. Il y fait la rencontre d’un groupe d’adolescents qui ont pour mission de gérer un site internet dont le nom est «Le garde du corps de Yui».
Ce site a pour vocation de protéger le quartier d’Akihabara et ses habitants de tous les problèmes générés par d’éventuels «hackers» mal intentionnés. Kôji, grâce à ses compétences informatiques hors normes, va tout naturellement intégrer cette équipe et donner ainsi un sens à sa vie.",Seinen,/imgs/mangas/akihabaraadeep.jpg,https://www.japscan.me/manga/akihabaraadeep/,https://www.japscan.me/manga/akihabaraadeep/,Japon,,,Manga ,2006
"Créer un paradis où les humains et les Yokai peuvent coexister, une lutte humaine et Yokai afin de réaliser un rêve. C'est leur histoire.",Shōnen,/imgs/mangas/ake-no-tobari.jpg,https://www.japscan.me/manga/ake-no-tobari/,https://www.japscan.me/manga/ake-no-tobari/,Japon,,,Manga Ake No Tobari,2014
"« Akatsuki » : maladie capable de contaminer tout être vivant, le transformant en monstre et l'entraînant vers une mort certaine. Seuls les médecins-guerriers surnommés « kiriishi » sont aptes à guérir les infectés à l’aide de leur « clave », une arme spéciale.
Hibiki et Kirisa ne sont kiriishi que depuis un mois. Et si Hibiki est un garçon un peu idiot et bourru qui affirme ne travailler que pour l’argent, Kirisa, quant à elle, agit pour le bien des patients et s’implique corps et âme dans sa mission. Les caractères très différents de ces deux personnages que tout oppose seront à l’origine de bien des situations cocasses.
Tous deux vont faire face à diverses formes d’akatsuki et se retrouveront confrontés à des situations périlleuses, qui révéleront la rage incommensurable de Hibiki contre cette maladie, malgré son apparente désinvolture...
L’argent et la gloire ne seraient pas les seules raisons qui le motivent dans sa mission ?",Shōnen,/imgs/mangas/akatsuki.jpg,https://www.japscan.me/manga/akatsuki/,https://www.japscan.me/manga/akatsuki/,Japon,,,Manga Akatsuki,2009
"Parfois, le monde peut se reveler plus doux qu'il ne semble l'être.","School Life, Ecchi, Tranche De Vie, Parodie",/imgs/mangas/a-kind-world.jpg,https://www.japscan.me/manga/a-kind-world/,https://www.japscan.me/manga/a-kind-world/,Japon,,,Manga A Kind World,Seinen
"""Ne deviendriez-vous pas la femme d'un gobelin ?""
À Yang-an, la capitale de l'empire de la dynastie Shun, il y a des rumeurs selon lesquelles une déesse chante une chanson qui exauce vos souhaits dans vos rêves si vous visitez une certaine pharmacie. Pour confirmer cela, Son Altesse Heonyoung, qui déguise son statut de membre de la famille royale, part à la recherche de la déesse des rumeurs. Après avoir écouté sa chanson, il est captivé par elle, comme s'il souffrait d'une maladie…

Un homme qui doit tuer sa propre identité sous le masque d'un gobelin; et une femme qui n'a ni nom ni amant, et ne vit que pour la vengeance de sa mère. Une histoire d'amour triste entre un homme et une femme qui sont les seuls à pouvoir se comprendre pleinement.",Josei,/imgs/mangas/a-kind-goblin-s-bird.jpg,https://www.japscan.me/manga/a-kind-goblin-s-bird/,https://www.japscan.me/manga/a-kind-goblin-s-bird/,Corée Du Sud,,,Manhwa A Kind Goblin's Bird,2020
"2030. Néo-Tokyo est devenue une gigantesque poubelle hi-tech. Tetsuo, Kanéda et leur bande de jeunes du centre d'insertion et d'apprentissage professionnel foncent dans la nuit sur des motos volées, sans autre but que de repousser toujours plus loin les limites du speed. Quand ils croisent un drôle de petit garçon au visage de vieillard, leur premier réflexe est de l'agresser mais cette créature perdue possède un étrange moyen de défense... Ils viennent de faire connaissance avec le n°26 et de franchir, sans s'en rendre compte, la première étape d'un processus irréversible : le réveil d'Akira...",Seinen,/imgs/mangas/akira.jpg,https://www.japscan.me/manga/akira/,https://www.japscan.me/manga/akira/,Japon,,,Manga Akira,1982
"Aoi Sora, un jeune homme au physique androgyne, vit avec trois magnifiques créatures : sa mère, sa sœur ainée Aki ainsi que sa jumelle Nami. Ils forment en apparence une famille normale sauf que Sora et Aki partagent un secret : ils sont amants !Un secret qui est sur le point d'être percé par Nami qui tente de caser son frérot avec son amie Kana en l'inscrivant au club de mode dont ils sont les trois seuls membres...",Seinen,/imgs/mangas/aki-sora.jpg,https://www.japscan.me/manga/aki-sora/,https://www.japscan.me/manga/aki-sora/,Japon,,,Manga Aki-Sora,2008
Un couple de jeunes un peu ingénu se retrouve avec la responsabilité d'une naissance. Un manga loufoque très attachant.,Shōjo,/imgs/mangas/akkan-baby.jpg,https://www.japscan.me/manga/akkan-baby/,https://www.japscan.me/manga/akkan-baby/,Japon,,,Manga Akkan Baby,2001
"Sena est le garçon le plus populaire du lycée et il ne laisse personne indifférent -y compris la meilleure amie de Minami. Malgré son rejet suite à sa déclaration d'amour, celle-ci continue d'idolâtrer Sena au point d'éveiller l'attention de Minami. Tout basculera cependant lorsque Minami fera une terrible découverte à son sujet...",Shōjo,/imgs/mangas/akuma-de-koi-shiyou.jpg,https://www.japscan.me/manga/akuma-de-koi-shiyou/,https://www.japscan.me/manga/akuma-de-koi-shiyou/,Japon,,,Manga Akuma De Koi Shiyou,2012
"Spin-off de Himouto! Umaru-chan à propos de l'amie d'Umaru, Ebina.",Seinen,/imgs/mangas/akita-imokko-ebina-chan.jpg,https://www.japscan.me/manga/akita-imokko-ebina-chan/,https://www.japscan.me/manga/akita-imokko-ebina-chan/,Japon,,,Manga Akita Imokko Ebina-Chan,2016
"Hiroyuki est le stéréotype du garçon de 16 ans qui commence à prendre son indépendance. Il a fait une super affaire avec une maison mais, alors qu’il déménage, il rencontre Milky Way. Milky est une démone et elle veut que Hiroyuki devienne son serviteur ! La vie d’Hiroyuki va alors être chamboulée par la magie, les démons et une relation triangulaire.",Shōnen,/imgs/mangas/akuma-jiten.jpg,https://www.japscan.me/manga/akuma-jiten/,https://www.japscan.me/manga/akuma-jiten/,Japon,,,Manga Akuma Jiten,2002
"Miu Sakurai est une jeune fille âgée de 15 ans, semblant tout ce qu'il y a de plus normale. Sauf qu'elle se meurt d'un amour transit pour le beau Shion, le garçon le plus populaire de son établissement. Désespérée, Miu découvre un jour une étrange librairie dans laquelle repose un livre capable de réaliser tous les souhaits. Miu décide alors d'utiliser l'une des formules retranscrites dans l'ouvrage afin de conquérir le cœur de Shion. Le démon ainsi invoqué, répondant au nom d'Akuma, accepte dès lors d'exaucer le voeu de la jeune fille, mais le prix à payer en vaudra-t-il la peine ? Akuma convoite en effet la virginité de la pauvre Miu...",Shōjo,/imgs/mangas/akuma-na-eros.jpg,https://www.japscan.me/manga/akuma-na-eros/,https://www.japscan.me/manga/akuma-na-eros/,Japon,,,Manga Akuma Na Eros,2001
"C'est l'histoire de Seriho, la propriétaire d'un salon de thé appelé 'La Maison de Thé Dorée' et de Sarasa, une étudiante qui y travaille à mi-temps. Est-ce que Seriho finira par ouvrir les yeux et s'apercevoir que Sarasa est amoureuse d'elle ?","Shōjo, Yuri",/imgs/mangas/ameiro-kouchakan-kandan.jpg,https://www.japscan.me/manga/ameiro-kouchakan-kandan/,https://www.japscan.me/manga/ameiro-kouchakan-kandan/,Japon,,,Manga Ameiro Kouchakan Kandan,2006
"Lee Wee-jin supporte normalement chacun de ses jours de lycée comme un serviteur de sa soeur parfaite Lee Wi-na. Cependant, il a un secret qu'il ne peut partager avec personne - qu'il peut matérialiser ses illusions comme il l'entend. Quand il a besoin de soulager le stress causé par sa sœur, il matérialise une version de sa propre sœur afin de la punir. Mais un jour, un étudiant transféré aux cheveux noirs dit ce qui suit à Wee-jin en brandissant un couteau contre lui : ""Espèce d'illusionniste qui matérialise les délires, nous, les réveilleurs, nous nous débarrasserons de vous tous !""",Seinen,/imgs/mangas/amentia.jpg,https://www.japscan.me/manga/amentia/,https://www.japscan.me/manga/amentia/,Corée Du Sud,,,Manhwa Amentia,2015
"''Mon enfant… Ton monde a toujours été divisé en deux. Il y a le monde dans lequel nous sommes nés et que nous prenons pour acquis, le monde dans lequel nous passons nos jours de mortels. Le monde vivant. Mais après cette fin, il y a un autre monde que certains d’entre nous atteignent.C’est le monde de la mort. Les cendres''",Shōnen,/imgs/mangas/a-messed-up-wuxia-world.jpg,https://www.japscan.me/manga/a-messed-up-wuxia-world/,https://www.japscan.me/manga/a-messed-up-wuxia-world/,Chine,,,Manhua A Messed-Up Wuxia World,2015
Go-Eun Ma et sont père sont sur le point de se faire expulser de leur maison hantée qu’ils gèrent depuis des années. Mais Go-Eun n’est pas prête de laisser le propriétaire du parc démolir sa maison et les souvenirs de sa mère. Elle décide donc de partir aux Etat-Unis pour surpasser les épreuves et gagner la récompense qui s’élève à un million de dollars en cash si elle survit à un séjour de 15 jours dans la maison du fantôme de Jack.,Seinen,/imgs/mangas/american-ghost-jack.jpg,https://www.japscan.me/manga/american-ghost-jack/,https://www.japscan.me/manga/american-ghost-jack/,Corée Du Sud,,,Manhwa American Ghost Jack,2013
"Dans un monde où seules les femmes sont nées avec la capacité d'exercer la magie, un garçon, Amel, est la seule exception. Dans ce monde, il doit cacher son sexe pour protéger sa légitimité. Issu de la prestigieuse famille Beans, il doit prouver qu'il est le praticien le plus compétent des arts magiques dans le processus de capture des évadés illicites de son pays d'origine.",Shōnen,/imgs/mangas/americano-exodus.jpg,https://www.japscan.me/manga/americano-exodus/,https://www.japscan.me/manga/americano-exodus/,Corée Du Sud,,,Manhwa Americano Exodus,2014
A Venir...,Nikaidou Kou,/imgs/mangas/ame-to-kimi-to.jpg,https://www.japscan.me/manga/ame-to-kimi-to/,https://www.japscan.me/manga/ame-to-kimi-to/,Japon,,,Manga Ame To Kimi To,"Tranche De Vie, Comédie, Animaux"
"Il a toujours pensé qu'il était un mortel, mais il ne savait pas que son jardin était rempli d'armes divines et que les poulets qu'il élevait étaient plutôt des phénix ! Ce n'est qu'après cinq ans de vie dans un village mortel que le système lui a finalement permis d'entrer en contact avec des cultivateurs. C'est alors qu'il a découvert que peu importe la force d'une personne, dès qu'elle le voyait, elle avait tellement peur que ses jambes s'engourdissaient et l'appelait senior. Certains se sont même agenouillés et l'ont vénéré...",Shōjo,/imgs/mangas/am-i-invincible.jpg,https://www.japscan.me/manga/am-i-invincible/,https://www.japscan.me/manga/am-i-invincible/,Corée Du Sud,,,Manhwa Am I Invincible,2021
"En 2038, un million de personnes se trouvant dans le centre de Tokyo furent dépouillées de leur mémoire en un instant. La cause de cet horrible incident n’a jamais été déterminée et aucun remède n’a été trouvé. Afin de juguler toute panique et de gérer ce mystère, le gouvernement a construit une seconde ville, sous Tokyo, où les personnes
affectés par ce mal étrange ont été parqués. Un nom a même été donné à ces victimes : les KID’z. Car, tels des enfants, ils doivent tout réapprendre, quel que soit leur âge. Si le mystère reste entier, les enquêteurs tentent toujours d’en trouver l’origine et la raison, d’autant qu’il semblerait que certaines personnes en savent plus qu’elles ne le prétendent.",Seinen,/imgs/mangas/amnesia.jpg,https://www.japscan.me/manga/amnesia/,https://www.japscan.me/manga/amnesia/,Japon,,,Manga Amnesia,2009
"Le jour de la destruction de la ville magique de Paz, Amina est restée coincée dans une lampe tout en essayant de remonter le temps. Et 300 ans plus tard, elle a été réveillée par un commandant militaire, Jackal. Anima, à chaque fois qu'elle exauce un souhait doit retourner dans la lampe...Cependant Jackal, lui, veut renoncer à ses souhaits pour être avec elle. Mais, de nombreux dangers et menaces l’en empêchent. Amina finira-t-elle par réaliser son souhait ?",Shōjo,/imgs/mangas/amina-of-the-lamp.jpg,https://www.japscan.me/manga/amina-of-the-lamp/,https://www.japscan.me/manga/amina-of-the-lamp/,Corée Du Sud,,,Manhwa Amina Of The Lamp,2019
"La raison du développement du capitalisme ? Dépenser notre argent est ce qui lui a permis de se déployer rapidement. Alors gaspillons notre argent et dépensons-le dans le luxe ! Découvrez les grandes idées de Werner Sombart développées dans son ouvrage Amour, luxe et capitalisme, mises en scène en pleine Révolution française !",Seinen,/imgs/mangas/amour-luxe-et-capitalisme.jpg,https://www.japscan.me/manga/amour-luxe-et-capitalisme/,https://www.japscan.me/manga/amour-luxe-et-capitalisme/,Japon,,,"Manga Amour, Luxe Et Capitalisme",2018
"Pour tenter d'éradiquer les démons, Akira avait emprisonné l'âme de l'un d'eux pour devenir «Devilman». Mais c'est finalement ce démon, Amon, qui prend le dessus, pour donner naissance à l'être maléfique le plus puissant que le monde ait jamais connu.",Seinen,/imgs/mangas/amon.jpg,https://www.japscan.me/manga/amon/,https://www.japscan.me/manga/amon/,Japon,,,Manga Amon,2000
"Homme ou femme, personne, dans son existence, n’échappe à ce moment où fatalement, l’amour fait mal... Il suffit de l’odeur d’un parfum pour faire resurgir le souvenir d’un ancien amant, volage et magnifique. Il suffit de croiser l’homme qu’on a tant aimé autrefois, pour retrouver ses sentiments d’antan. Il suffit encore de songer à ce corps que l’on donne en pâture contre de l’argent, pour se dégoûter soi-même. Et il suffit parfois de la promesse d’un amour éternel, pour que notre petit monde vacille...
En vingt-trois courts récits, Kiriko Nananan explore les sentiments amoureux dans toute la splendeur de leur cruauté. Sa sensibilité exacerbée, portée par son trait lisse et net, fait une fois de plus merveille.",Seinen,/imgs/mangas/amours-blessantes.jpg,https://www.japscan.me/manga/amours-blessantes/,https://www.japscan.me/manga/amours-blessantes/,Japon,,,Manga Amours Blessantes,1997
"Lynn, l’héroïne du jeu en ligne Amour Sucré souhaite organiser son anniversaire. Sa tante qui organise une fête en secret avec tous ses amis le lui interdit. D’abord démoralisée et finalement remontée à bloc par ses prétendants malgré eux, Lynn va finalement décider de l’organiser. Son plan va être parasité par un mystérieux SMS qui va la conduire dans les bras des trois garçons qui l’attirent.","School Life, Tranche De Vie, Romance",/imgs/mangas/amour-sucre.jpg,https://www.japscan.me/manga/amour-sucre/,https://www.japscan.me/manga/amour-sucre/,Japon,2012,Terminé,Manga Amour Sucré,Shōjo
"Bin He a un amour à sens unique pour son meilleur ami, Hai. Pendant leur voyage de fin d'études à l'université, Bin He se sentait déprimé car son meilleur ami allait enfin sortir avec la fille qu'il aime. Ils décident d'organiser une compétition de plongeon amicale. En plongeant, Bin He voit un homme enchaîné à une épave de bateau au fond de la mer.
Sous la mer commence un amour anaérobie. Que va naître de cette fatidique rencontre?",Shounen Ai,/imgs/mangas/anaerobic-love-prisoner-of-the-deep-sea.jpg,https://www.japscan.me/manga/anaerobic-love-prisoner-of-the-deep-sea/,https://www.japscan.me/manga/anaerobic-love-prisoner-of-the-deep-sea/,Chine,,,Manhua Anaerobic Love: Prisoner Of The Deep Sea,2019
"Dans l'Hokkaido moderne, un ours brun est apparu près d'une école primaire. Un membre de l'association locale des chasseurs est donc envoyé pour l'exterminer. Cependant, il est tué par l'ours et se réveille dans un monde imaginaire, armé seulement du fusil de chasse Remington M870 qu'il avait quand il est mort.",Shōnen,/imgs/mangas/an-active-hunter-in-hokkaido-has-been-thrown-into-a-different-world.jpg,https://www.japscan.me/manga/an-active-hunter-in-hokkaido-has-been-thrown-into-a-different-world/,https://www.japscan.me/manga/an-active-hunter-in-hokkaido-has-been-thrown-into-a-different-world/,Japon,,,Manga An Active Hunter In Hokkaido Has Been Thrown Into A Different World,2020
"Luchiru est un Majin qui vit sous la surface de la terre. Il a été envoyé à la surface en tant qu'espion pour recueillir des informations afin de vaincre les humains qui y vivent. Mais le problème est que les Majins ont une compréhension totalement fausse sur les humains, ils croient fermement que la race humaine est de loin supérieur à eux, ce qui est l'inverse. Comment Luchiru peut-il survivre dans le monde humain où il a des points de vue erroné sur la force des êtres humains, dont il croit fermement que rien que les toucher pourrait le faire brûler et être désintégré en un instant?!",Shōnen,/imgs/mangas/anagle-mole.jpg,https://www.japscan.me/manga/anagle-mole/,https://www.japscan.me/manga/anagle-mole/,Japon,,,Manga Anagle Mole,2011
"Amélie et ces amies sont considérés comme le « Trio fantomatique » du lycée, ce qui leur convient parfaitement. Amélie elle même juge l’amour inutile et comme une nuisance. Elle préfère regarder des film seule chez elle comme un ours. Cependant, son ami d’enfance et le garçon le plus beau de l’école ce trouve dans sa classe… Les choses pourraient alors changer...",Shōjo,/imgs/mangas/anagura-amelie.jpg,https://www.japscan.me/manga/anagura-amelie/,https://www.japscan.me/manga/anagura-amelie/,Japon,,,Manga Anagura Amelie,2015
