description,genres,img,last_chapter,link,origin,published_date,state,title,type
"Ushiyama (surnom : Operator) appartient à une secte appelée Niconico Jinsei Center. Un jour il décide avec 2 autres amis (Hishiko, une jeune femme et Daisan Honbuchô, un garçon) d'aller sur une île déserte. Cela fait partie du projet Kotô no Programme. Ainsi on va suivre la vie quotidienne de ces 3 personnes. Au début tout va bien, mais peu à peu, la situation va changer...",Seinen,/imgs/mangas/believers.jpg,https://www.japscan.me/manga/believers/,https://www.japscan.me/manga/believers/,Japon,,,Manga Believers,1999
La doctoresse Wei est sans dessus-dessous après avoir découvert qu'elle a couché avec une fille de seize ans et décide donc de tirer un trait sur celle-ci. Cependant pour une certaine raison éviter la jeune fille n'est pas aussi facile qu'elle ne le pensait...,Yuri,/imgs/mangas/beloved.jpg,https://www.japscan.me/manga/beloved/,https://www.japscan.me/manga/beloved/,Chine,,,Manhua Beloved,2016
"L’intello Azusa Yano est secrètement amoureuse du beau Kaoru Aota, mais il est résolument inaccessible pour elle. Jusqu’au jour où ce dernier se met à se rapprocher d’elle physiquement. N’arrivant pas à le repousser, Azusa devient petit à petit une véritable esclave pour lui ! Mais les choses vont se compliquer lorsque la jeune lle découvre que son petit ami est amoureux d’une autre femme... Entre manipulation et trahison qui saura dominer l’autre ?",Shōjo,/imgs/mangas/be-my-slave.jpg,https://www.japscan.me/manga/be-my-slave/,https://www.japscan.me/manga/be-my-slave/,Japon,,,Manga Be My Slave,2013
"Pour une nuit, la timide Valentina d'Angeli aimerait être une femme confiante et attirante. Aussi, quand elle rencontre un homme diaboliquement beau au carnaval de Venise, elle oublie toute prudence et se donne complètement à lui. Ils n'ôtent pas leur masque et passe une nuit enchanteresse. Mais le lendemain matin, lorsque Tina jette un oeil à celui qui se cache sous ce masque, elle s'aperçoit qu'il s'agit du rival de son frère : Nico Gravetti ! Choquée par l'ironie du destin, elle s'enfuie sans un mot, pour découvrir, deux mois plus tard, qu'elle porte son enfant !",Josei,/imgs/mangas/benechia-no-yoru-ni-moete.jpg,https://www.japscan.me/manga/benechia-no-yoru-ni-moete/,https://www.japscan.me/manga/benechia-no-yoru-ni-moete/,Japon,,,Manga Benechia No Yoru Ni Moete,2014
"Benkei est un artiste japonais expatrié aux Etats-Unis, vivant à New York, comme beaucoup d'autres... Enfin c'est ce qu'on pourrait penser... Comme le montrent ces sept diaboliques histoires, il ne faut pas se fier aux apparences. Des flashbacks fouillent dans les secrets sordides du passé, faisant réapparaître de vieilles blessures qui ne demandent qu'à être guéries. Et le secret de Benkei ? Que cache donc ce mystérieux personnage d'apparence si paisible ? Chaque épisode de ""Benkei"" est un magnifique voyage psychologiquement déchirant au coeur des ténèbres de la ville. De dures histoires de vengeance, dignes des plus grands romans noirs, mises en scène avec les traits fins caractéristiques du style de Jiro Taniguchi.",Seinen,/imgs/mangas/benkei-in-new-york.jpg,https://www.japscan.me/manga/benkei-in-new-york/,https://www.japscan.me/manga/benkei-in-new-york/,Japon,,,Manga Benkei In New-York,1995
"Yoo Nan Hee, est une lycéenne, présidente du club de théâtre du son lycée. Récemment, elle est devenue très lunatique et se met très souvent en colère contre Jan Gook Yung, un de ces camarade de classe. Une de ses amies lui suggère qu'elle est peut-être amoureuse de Jan Gook Yung. Peu après, elle entends des filles parler de lui et de Oh Eun Yung, la princesse de la classe 12. Alors que le soir les membres du clubs fêtent le succès de leur pièce, Yoo Nan Hee se saoule. Jang Gook Yung se voit alors obligé de la raccompagner chez elle... Pour le meilleur et le pire.",Shōjo,/imgs/mangas/be-my-sweet-darling.jpg,https://www.japscan.me/manga/be-my-sweet-darling/,https://www.japscan.me/manga/be-my-sweet-darling/,Corée Du Sud,,,Manhwa Be My Sweet Darling,2003
"On suit les aventures de Guts, un mercenaire pour qui seuls les combats, la guerre, comptent. Jusqu'au jour où il rencontre un mystérieux jeune homme au charisme surprenant, Griffith.",Seinen,/imgs/mangas/berserk.jpg,https://www.japscan.me/manga/berserk/,https://www.japscan.me/manga/berserk/,Japon,,,Manga Berserk,1989
"Ce manga nous entraîne à la suite de Takumi Aono, un collégien fou de natation. De natation de compétition pour être exact !",Shōnen,/imgs/mangas/best-blue.jpg,https://www.japscan.me/manga/best-blue/,https://www.japscan.me/manga/best-blue/,Japon,,,Manga Best Blue,2015
"Mai Amane, quinze ans, est montée à Tokyo dans l'espoir de devenir une star du rock... mais elle se retrouve cantonnée à un duo d'idoles interprétant d'inoffensives chansons rigolotes, « Star Berry ». Pire : sa partenaire, Kurumi, fait preuve d'un enthousiasme à toute épreuve et est littéralement enchantée. Mai, quant à elle, songe sérieusement à mettre un terme prématuré à ce début de carrière honteux. Oui, mais voilà : rien n'est simple dans le showbiz : ni d'y entrer, ni d'en sortir ! En effet, les coups bas d'une impitoyable et célèbre productrice, qui chapeaute un groupe concurrent, vont piquer au vif l'orgueil de la jeune femme : il n'est plus question pour Mai de fuir ce milieu...",Shōjo,/imgs/mangas/berry-dynamite.jpg,https://www.japscan.me/manga/berry-dynamite/,https://www.japscan.me/manga/berry-dynamite/,Japon,,,Manga Berry Dynamite,2009
"Ier siècle après Jésus-Christ, l’Empire romain est à son apogée et ses légions soumettent une à une les dernières contrées où monstres et humains vivent encore en paix. Criminels, innocents, orphelins, demi-humains, wyvernes... Tous constituent les rangs d’esclaves guerriers jetés dans l’arène et forcés de s’entretuer pour divertir l’empereur Domitien et les Romains avides de sang. Parmi ces combattants se trouvent des gladiateurs qui affrontent fauves et créatures légendaires : on les appelle les “Bestiari”. Or, certains d’entre eux, comme Finn ou Zénon, ont été élevés aux côtés de ceux qui, aux yeux de Rome, ne sont que de simples bêtes, et ils comptent bien retourner leurs armes contre leurs geôliers... et même contre l’Empire tout entier !",Shōnen,/imgs/mangas/bestiarius.jpg,https://www.japscan.me/manga/bestiarius/,https://www.japscan.me/manga/bestiarius/,Japon,,,Manga Bestiarius,2011
"Il était une fois, deux anges qui étaient meilleures amies. Elles étaient inséparable, aussi belles que de vraies fleurs. Tout était paisible. Un jour, l'une d'elle tomba amoureuse d'un démon. Seulement, la jeune fille n'eut guère le droit de l'être, une règle était imposée ; ""il est interdit de tomber amoureuse d'un démon lorsqu'on est un ange"" Ce qui fit naître une colère terrible de l'autre jeune fille, n'acceptant guère cet amour interdit... Alors, elle essaya par tous les moyens de mettre fin à cet amour, mais... cela ne se passa pas comme prévu; le démon et la jeune fille tombèrent amoureux. Mais, elle, ne voulant pas trahir sa meilleure amie, eut une idée cruelle et décida de prendre rendez-vous avec le démon. La jeune fille se rendit sur une tour, accompagnée du démon, puis hésita un long moment, avant de faire quelque chose d'horrible. Une fois décidée, elle se rendit sur l'un des rebords de la tour puis poussa le démon en prononçant avec quelques larmes ruisselant sur son jolie visage : ""Je suis désolée...Je t'aime...pardonne-moi."" Le démon tomba de la tour puis mourut. L'ange devint à ce moment, un démon. Mais regrettant son geste, ses yeux se remplirent de larmes et elle se dit alors : ""Je l'ai fais pour nous tous, elle sera blessée en apprenant que moi et ce démon sommes tombés amoureux, et nous ne serions pas heureux. Quel est l'intérêt de vivre à présent?"" Suite à ces paroles, elle se suicida.",Shōnen,/imgs/mangas/berserk-of-gluttony.jpg,https://www.japscan.me/manga/berserk-of-gluttony/,https://www.japscan.me/manga/berserk-of-gluttony/,Japon,,,Manga Berserk Of Gluttony,2018
"Shizuku a beaucoup de mal avec les garçons « canons ». Elle les trouve cruels avec les filles et imbus d’eux-mêmes. Cependant, pour faire plaisir à une copine de classe, elle se résout à adresser la parole au beau et doux Tamaki Yagami. Mais elle se trompe, et va voir son frère jumeau, Kaede ! Aussi brutal dans ses manières que dans son apparence, ce dernier va lui demander d’emblée de sortir avec lui ! Se laissera-telle charmer par l’un des jumeaux Yagami… ?",Shōjo,/imgs/mangas/be-twin-you-me.jpg,https://www.japscan.me/manga/be-twin-you-me/,https://www.japscan.me/manga/be-twin-you-me/,Japon,,,Manga Be-Twin You & Me,2016
"Les Saishi sont une race mystérieuse, on les croyait tous disparus apres avoir étaient victimes d'un génocide. Le général Tuskinosuke est le dernier des Saishi et a le titre de ""Canine de Dieu"" en raison de sa maitrise divine du sabre... et toute femme qui couche avec lui mourra.",Seinen,/imgs/mangas/bestia.jpg,https://www.japscan.me/manga/bestia/,https://www.japscan.me/manga/bestia/,Japon,,,Manga Bestia,2000
"Hari a été adoptée par la famille Ernst à l'âge de 7 ans après avoir perdu sa mère. Elle a subi toutes sortes de persécutions de la part des trois fils Ernst, mais cette misérable vie arrivait bientôt à terme lorsqu'elle était sur le point de se marier. Mais qu'est-ce qu'il se passe ? À mon réveil, je suis revenue à cette enfance infernale ! Est-ce un rêve ?! Pff, si je ne peux pas me réveiller de ce rêve, alors cette fois-ci je vais vivre sans prendre les autres en considération !",Shōjo,/imgs/mangas/beware-of-the-brothers.jpg,https://www.japscan.me/manga/beware-of-the-brothers/,https://www.japscan.me/manga/beware-of-the-brothers/,Corée Du Sud,,,Manhwa Beware Of The Brothers!,2020
"Peu de temps après m'être réveillé en tant que méchante, j'ai vu mon fiancé, le rôle principal du roman, le prince héritier, me tromper. Je l'ai vu embrasser une femme autre que moi et il souriait. J'ai fondu en larmes… Je plaisante, je n'ai pas pleuré ! Mes larmes valent trop pour être gaspillées sur cette ordure. A la place des larmes, j'ai crié: ""Votre Altesse, êtes-vous un fils de pute ?"". Je suis la protagoniste qui va complètement jeter l'histoire principale! Pourquoi ? Parce que c'est une perte pour une fille d'être entourée d'hommes bon marché.","Fantastique, Historique, Romance",/imgs/mangas/beware-of-the-villainess.jpg,https://www.japscan.me/manga/beware-of-the-villainess/,https://www.japscan.me/manga/beware-of-the-villainess/,Japon,2020,En Cours,Manga Beware Of The Villainess !,Shōjo
"[Adapté du webnovel 'Le Phénix qui a remplacé la mariée : Tyrant Prince's Private Doting of the Bewitching Empress'] Pendant son enfance, Liu Rushuang a failli perdre la vie à cause des plans combinés de son père et de la matrone en chef. Dix ans plus tard, elle revient pour planifier sa vengeance en occupant le plus haut poste dans une organisation d'assassinat bien connue, appelée ""Bloody Repose"". Cependant, elle est soudainement traquée par un seigneur tyrannique d'une nation, Han Moze. Sa vengeance se passera-t-elle sans accroc ? Et quel genre d'histoire palpitante va-t-elle vivre avec ce seigneur tyrannique ?",Josei,/imgs/mangas/bewitching-empress-so-pampered-by-her-tyrant.jpg,https://www.japscan.me/manga/bewitching-empress-so-pampered-by-her-tyrant/,https://www.japscan.me/manga/bewitching-empress-so-pampered-by-her-tyrant/,Chine,,,Manhua Bewitching Empress So Pampered By Her Tyrant,2020
"Alice s'est réveillée dans la chambre 431 d'un manoir étrange. ""Tu ne dois pas partir de cette chambre."" l'a averti Serpent, mais elle ne l'a pas écouté et son corps à commencé à pourrir..."" Arrivera-t-elle a s'échapper de ce manoir maudit ?","Fantastique, Drame, Surnaturel, Post-Apocalyptique, Horreur, Aventure, Monstres, Psychologie",/imgs/mangas/bibliomania.jpg,https://www.japscan.me/manga/bibliomania/,https://www.japscan.me/manga/bibliomania/,Japon,2019,Terminé,Manga BIBLIOMANIA,Seinen
"Alors que la jeune Mana voyage de ville en ville et compte bien s'amuser à Toykyo, elle tombe sur un garçon pas très fut-fut en train de s'extasier devant le héros de sa série préférée. Après avoir fait sa connaissance (c'est-à-dire, lui être rentré dedans avec son scooter), elle découvre qu'il est un ""Clown"" : un humain qui s'est vu octroyer un pouvoir en échange d'une condition spécifique. Showtaro, c'est son nom, peut ainsi utiliser les capacités de divers animaux à partir de leurs os, à condition d'accomplir une bonne action par jour. Après quelques péripéties, Mana décide d'aider Showtaro à retrouver Emine, son ami d'enfance. Le voyage qui commence ne sera pas de tout repos !",Shōnen,/imgs/mangas/b-ichi.jpg,https://www.japscan.me/manga/b-ichi/,https://www.japscan.me/manga/b-ichi/,Japon,,,Manga B Ichi,2002
"Zyro, jeune blader fougueux, s’est mis en tête de surpasser les légendaires Gingka et Pegasus !! Afin de devenir le meilleur blader du monde, il arrive en ville armé de sa toupie, Samurai Ifrit, pour défier les adversaires les plus forts qui soient. Mais Zyro n’est pas au bout de ses peines, car il se retrouve confronté à un stadium d’un genre nouveau… Notre héros devra donc améliorer sa technique au cours de combats Beyblade plus épiques les uns que les autres !",Shōnen,/imgs/mangas/beyblade-shogun-steel.jpg,https://www.japscan.me/manga/beyblade-shogun-steel/,https://www.japscan.me/manga/beyblade-shogun-steel/,Japon,,,Manga Beyblade Shogun Steel,2012
"Gingka perd lors du duel qui l'oppose à son rival Ryûga, leader de la mystérieuse organisation « Dark Nebula » et assassin de son père. Qui plus est, son Beyblade Pegasus a été détruit. Heureusement, guidé par Mawashi, un étrange singe qui se dit être le Dieu du Beyblade, il va réussir l'épreuve qui lui permet de récupérer un tout nouveau Beyblade Storm Pegasus. Il est prêt à prendre sa revanche sur Ryûga lors du grand tournoi des Beybladers !",Shōnen,/imgs/mangas/beyblade-metal-fusion.jpg,https://www.japscan.me/manga/beyblade-metal-fusion/,https://www.japscan.me/manga/beyblade-metal-fusion/,Japon,,,Manga Beyblade Metal Fusion,2008
"Bien qu’il soit encore un débutant, Valt Aoi est déjà un véritable passionné de toupies Beyblade ! Il vient de s’inscrire au Tournoi des Districts car il n’a qu’un seul rêve : devenir le meilleur blader du monde.
Mais notre jeune héros va devoir faire face à des adversaires redoutables ; et s’il veut les surpasser, il devra s’entraîner dur pour se perfectionner, optimiser ses techniques et développer de nouvelles bottes secrètes.","Fantastique, Action, Comédie, Sports, Aventure, Science-fiction",/imgs/mangas/beyblade-burst.jpg,https://www.japscan.me/manga/beyblade-burst/,https://www.japscan.me/manga/beyblade-burst/,Japon,2015,En Cours,Manga Beyblade Burst,Shōnen
"Vienne, 1908. Dimitri, un jeune chanteur d'opéra, se relève inexplicablement d'un accident mortel. Peu après, suicides et autres morts étranges se multiplient dans son entourage. Quand un mystérieux personnage l'approche avec de terrifiantes révélations, Dimitri prend conscience que quelque chose en lui est en train de changer... Tokyo, 2008. Azusa, une jeune enseignante japonaise, vit une douloureuse aventure avec un de ses élèves, jusqu'au jour où un événement dramatique vient bouleverser son existence. Setona Mizushiro revisite le mythe du vampire dans un opéra macabre par delà le temps et la mort.",Shōjo,/imgs/mangas/black-rose-alice.jpg,https://www.japscan.me/manga/black-rose-alice/,https://www.japscan.me/manga/black-rose-alice/,Japon,,,Manga Black Rose Alice,2008
"Trois monde se partagent la planète : le monde céleste, le monde des humains, et le monde du mal. Un jour eu lieu ""la grande bataille du monde céleste"" qui opposa les forces du monde céleste à celles des forces du mal. Un homme mit fin à cet affrontement en faisant pencher la balance du coté céleste. La guerre finit, il disparut, laissant son épée plantée en haut du mont céleste. Aujourd'hui ce symbole de justice à disparu. Shoma, un jeune humain est accusé de vol et est contraint par le roi du monde céleste de partir à la recherche de l'épée...",Shōnen,/imgs/mangas/blade-of-heaven.jpg,https://www.japscan.me/manga/blade-of-heaven/,https://www.japscan.me/manga/blade-of-heaven/,Corée Du Sud,,,Manhwa Blade Of Heaven,2005
"Woo Hyun est invité par son amie d ’enfance Dana dans un petit village a une dizaine d ’heures de vol de Londres pour lui annoncer une seule chose : elle a découvert une sorcière à Roselum. Dana est sûre que les sorcières ont réellement existé et Woo Hyun n ’y croit pas vraiment, mais les futurs événements vont le faire changer d ’avis.",Shōnen,/imgs/mangas/black-wind.jpg,https://www.japscan.me/manga/black-wind/,https://www.japscan.me/manga/black-wind/,Corée Du Sud,,,Manhwa Black Wind,2010
"Shinta, un lycéen normal sur son chemin d'école, se retrouve (encore une fois) dans un accident, mais au lieu de mourir, il est sauvé par une jeune fille vêtue seulement de noir. Elle dit qu'elle est une shinigami et qu'elle est venue afin de devenir sa femme, comme promis. Par l'auteur de Kamen no Maid Guy, une comédie perverse avec un personnage principal sans vergogne !",Shōnen,/imgs/mangas/black-yome-ni-yoroshiku.jpg,https://www.japscan.me/manga/black-yome-ni-yoroshiku/,https://www.japscan.me/manga/black-yome-ni-yoroshiku/,Japon,,,Manga Black Yome Ni Yoroshiku!,2013
Le périple vers Élysium d'une héroïne se dressant face aux démons qui menacent de plonger le monde dans les ténèbres. Tiré d'un jeu coréen nommé Blade 2. Série fini en 8 chapitres,Yim Rina,/imgs/mangas/blade-2-the-return-of-evil.jpg,https://www.japscan.me/manga/blade-2-the-return-of-evil/,https://www.japscan.me/manga/blade-2-the-return-of-evil/,Corée Du Sud,"Fantastique, Démons, Action, Aventure, Monstres",Terminé,Manhwa Blade 2 - The Return Of Evil,Wan Gyul
"Blade Note nous entraîne dans un monde sombre, où le héros se qualifie lui-même de ""quelqu'un qui nettoie ce monde de ses ordures"". Les ordures, ce sont les mafieux et malfrats en tout genre qui croissent en ce bas monde. Et pour les ""nettoyer"", il utilise un katana....",Seinen,/imgs/mangas/blade-note.jpg,https://www.japscan.me/manga/blade-note/,https://www.japscan.me/manga/blade-note/,Corée Du Sud,,,Manhwa Blade Note,2015
"En tant que descendant d'une famille de shinobi, Jirou Azuma a appris des techniques de ninja toute sa vie. En plus de cela, il a aussi la capacité de parler aux animaux. Un jour, il sauve un étrange chat noir nommé Ragou et apprend que le monde est rempli d'esprits appelés Mononoke qui peuvent prendre la forme de personnes et d'animaux. Cependant, leur rencontre est interrompue par un Mononoke hostile qui en a après la puissance de Ragou.",Shōnen,/imgs/mangas/black-torch.jpg,https://www.japscan.me/manga/black-torch/,https://www.japscan.me/manga/black-torch/,Japon,,,Manga Black Torch,2017
"Une ancienne légende inuit raconte qu’une fois tous les sept ans, les esprits de toutes les proies abattues par les chasseurs se réincarnent dans un être surpuissant à l’apparence d’un chien blanc, venu enlever la vie des hommes.
Hiver 1989, Alaska. Deux chasseurs sont attaqués par un chien blanc à la tête d’une meute de loups. Victime d’un assaut extraordinaire de la bête, l’un des deux hommes est tué sur le coup. Par la suite, l’armée américaine met secrètement la tête de l’animal à prix auprès de trappeurs chevronnés. Une chasse est lancée et un carnage a bien lieu : celui de tous les braconniers. Une poursuite acharnée s’engage alors contre ce prédateur…
Quel secret se cache derrière ce simple chien blanc pourtant si redoutable ? Légende maléfique ou secret militaire bien gardé ?",Seinen,/imgs/mangas/blanco.jpg,https://www.japscan.me/manga/blanco/,https://www.japscan.me/manga/blanco/,Japon,,,Manga Blanco,1984
"Dans le royaume d’Avista, douze grands généraux et éminents sorciers assurent la sécurité du peuple : les Paladins. Junk est le fils de l’un d’entre eux, Jean Whattear, l’incarnation du soleil. Mais constamment éclipsé par ce père illustre auquel il est censé succéder, Junk peine à trouver sa place. Alors, le jour de la cérémonie qui doit faire de lui un sorcier à son tour, le garçon se rebelle contre le destin ! Mais un événement tragique pourrait bien le faire revenir sur sa décision…",Shōnen,/imgs/mangas/black-shadow.jpg,https://www.japscan.me/manga/black-shadow/,https://www.japscan.me/manga/black-shadow/,Japon,,,Manga Black Shadow,2017
"Peut-être sur Terre... Peut-être dans le futur... Killy est un cyborg taciturne qui erre dans une gigantesque cité labyrinthique, s'étendant sur des milliers de niveaux. Armé d'un revolver amplificateur de radiations et accompagné de Shibo, un scientifique, il part en quête du ""net-gene"", un programme qui aurait échappé à la contamination globale d'un virus informatique, et qui serait capable de gérer le monde.",Seinen,/imgs/mangas/blame.jpg,https://www.japscan.me/manga/blame/,https://www.japscan.me/manga/blame/,Japon,,,Manga Blame!,1997
"Histoires parodiques, humoristiques, mais aussi aventures originales, suite directe de la série Blame ou récit lié à son autre œuvre Abara, Blame Gakuen se présente comme un patchwork d’aventures éclairant l’univers de Blame. Nihei fait ici preuve d’une maestria visuelle sans pareille, alternant les styles graphiques au gré des tons divers de ses nouvelles, mais la particularité de ce recueil est d’être totalement en couleurs. L’auteur propose dans ce one shot une exploration étonnante et réussie de la mise en couleur par ordinateur, dont il sait tirer le meilleur, et qui s’adapte à merveille à ses univers de science-fiction. La lecture vous plonge ainsi dans un autre monde, irréel, futuriste et mystique.",Seinen,/imgs/mangas/blame-gakuen-and-so-on.jpg,https://www.japscan.me/manga/blame-gakuen-and-so-on/,https://www.japscan.me/manga/blame-gakuen-and-so-on/,Japon,,,Manga Blame Gakuen! And So On,2008
"""Escorte"", fait référence à des guerriers, payés pour protéger leurs cibles, fait aussi référence à des cibles recherchées par le gouvernement. À la veille d'un chaos civil pendant les dernières années de la dynastie Sui, avec la montée du règne de la terreur autour du pays, de nombreux sentiments d'animosités et de rancunes se développent...",Shōnen,/imgs/mangas/blades-of-the-guardians.jpg,https://www.japscan.me/manga/blades-of-the-guardians/,https://www.japscan.me/manga/blades-of-the-guardians/,Chine,,,Manhua Blades Of The Guardians,2015
"Kael (alias Ryu Shiho) était une menace dans sa forme angélique, il harcelait d'autres anges quand il le pouvait. Par conséquent, les pères célestes ont décidés de l'expulser vers le monde des humains, en espérant que son comportement s'améliorerait. Mais ... Ils avaient tort. Son attitude ne c'est pas du tout amélioré, et pour couronner le tout, les êtres humains l'appellent «Lucifer» en raison de ses mauvaises actions et ses yeux effrayants. S'il veut voir les portes du ciel s'ouvrirent pour lui à nouveau, il doit effectuer une centaine de bonnes actions ... Cette épreuve ne serait pas impossible a réaliser pour lui ?","Fantastique, School Life, Surnaturel, Action, Comédie, Aventure",/imgs/mangas/blast.jpg,https://www.japscan.me/manga/blast/,https://www.japscan.me/manga/blast/,Corée Du Sud,2007,Terminé,Manhwa Blast,Shōnen
"Revenez aux années 1880 aux etats-unis, durant lesquelles le KKK prospérait et la communauté afro-américaine vivait dans la terreur. Les Afro-américains ne craignaient pas uniquement le KKK parce qu'ils les battaient, les violaient ou les tuaient. Non. Ils craignaient le KKK parce que le KKK les devorait. Ils etaient appelés pertinnement les mangeurs-d'hommes, une sorte de melange entre des loups-garous et des vampires. Ils se repaissaient de chair humaine, pouvaient se metamorphoser en plusieurs formes, et etaient pratiquement immortels. Seul un homme, un ancien boxeur poids-lourds appelé Victor Freeman, ose se dresser contre eux. Equipé d'un petit arsenal et de coups de poings americain customisés, notre héros pourra-t'il defendre son peuple et prendre sa revanche sur son passé ?","Drame, Mature, Surnaturel, Action, Horreur, Histoire",/imgs/mangas/blaster-knuckle.jpg,https://www.japscan.me/manga/blaster-knuckle/,https://www.japscan.me/manga/blaster-knuckle/,Japon,1992,Terminé,Manga Blaster Knuckle,Seinen
"Alice ne s'amuse toujours pas beaucoup. Elle a survécu à une agression d'assassins dans son école, mais toutes ces batailles, la vérité derrière sa famille, les deux trahisons de faux amis qui sont morts et la perte de son arme-couteau Kumoito ont eu des répercussions sur son mental.

Elle passe ses journées seule à fendre la tête des zombies violeurs qui ont envahi le Japon. L'Organisation veut l'embaucher comme nouveau patron, et ses alliés Gokiburi et Kabutomushi la recherchent.",Shounen,/imgs/mangas/blattodea.jpg,https://www.japscan.me/manga/blattodea/,https://www.japscan.me/manga/blattodea/,Japon,,,Manga Blattodea,2020
A Venir...,"Drame, School Life, Surnaturel, Tranche De Vie, Romance, Psychologie, Webtoon",/imgs/mangas/blaze.jpg,https://www.japscan.me/manga/blaze/,https://www.japscan.me/manga/blaze/,Corée Du Sud,,,Manhwa Blaze,2016
